author,title,source
Aahzymandias,Coverville Cat Cuddles,showbot
Aahzymandias,Headphone cliff hanger,showbot
Aahzymandias,Powerless Brian,showbot
Aahzymandias,You like us! You REALLY REALLY Like us!,showbot
BrainbowBrite99, Reaching Golf Ball Radius,YouTube
Brainbowbrite,Convert Me into Dog Brain,showbot
Brainbowbrite,"Forget Coverville, Welcome to Funkytown",showbot
Ian L (i_am_scifi)," Dip It In Peril, You!",YouTube
Ian L (i_am_scifi), Don't Trust a Strange Man in the Woods with Amy,YouTube
Ian L (i_am_scifi), Impressed By Chuck's Croissants with Amy,YouTube
Ian L (i_am_scifi)," It's All Dirt To Me, Dammit!",YouTube
Ian L (i_am_scifi), Oliver the Frenchman,YouTube
Ian L (i_am_scifi), Show and Yell,YouTube
Ian L (i_am_scifi)," Show, Tell and Boom",YouTube
Ian L (i_am_scifi), Someone Set Us Up the Show and Tell Bomb,YouTube
Ian L (i_am_scifi), There's Tomato in My Wine. Tomato Shouldn't Be in Wine.,YouTube
Ian L (i_am_scifi), Wacky and Cool,YouTube
Ian L (i_am_scifi)," You Want Disgusting? Here, Hold My Pizza Wine",YouTube
Ikcor," Puppets, Muppets, and Crumpets with Amy",YouTube
JayFunktastic,Hat History,showbot
JayFunktastic,Musty Ibbott,showbot
JayFunktastic,Nein Times,showbot
LesleyHayes4, Bitterswet Mix with Amy,YouTube
LesleyHayes4, Spoilering Fun Chasers with Amy,YouTube
LesleyHayes4, W.A.I.T. with Amy,YouTube
Matooba,The Funky Ibbot,showbot
Monica Stone, Fun Chasers with Amy,YouTube
PhillyCodeHound, cork dork,YouTube
PhillyCodeHound, food bomb tomato wine,YouTube
PhillyCodeHound, new wine space,YouTube
PhillyCodeHound, no beer has passed Scott's face,YouTube
Red Fraggle, Never a beer has passed my face,YouTube
Red Fraggle, Of course it's a Red,YouTube
Shaun Bloom, Generally Wholesome Family Entertainment,YouTube
Thomas Chambers, Vampire Recommendations in a Certain Vein,YouTube
Tim Watson (TRPW), Karen Slaughter or Karen's Laughter,YouTube
Tim Watson (TRPW), Karen Slaughter or Karen's Laughter with Amy,YouTube
Tim Watson (TRPW), No Grapes Were Harmed In The Making Of This Wine,YouTube
Tim Watson (TRPW), You Lost Me At Toasted Oak,YouTube
Wickedkitten13,Where are the Charles’?,showbot
ZoeBringsBacon, All The Degrees Of Dirt,YouTube
ZoeBringsBacon, Hat Or Pants Invasion,YouTube
ZoeBringsBacon, Show And Yell,YouTube
ZoeBringsBacon,Brown Out Brian,showbot
ZoeBringsBacon,How Much For A Bushel of Plums?,showbot
ZoeBringsBacon,No Electric Knife For Nancy,showbot
ZoeBringsBacon,Stuck Between Thomas And Nancy,showbot
ambassador_domo,"No Longer Orange Theory, It's Law",showbot
ambassador_domo,Rubbing the &#34;EMU&#34; in,showbot
le_sarge,"30,000 Years of Hat Technology Advancement",showbot
le_sarge,Barehand Turkey Ripper,showbot
le_sarge,TMS: Generally Wholesome,showbot
le_sarge,"Which Came First, the Hat or the Shirt?",showbot
naughtomaton, Sounding better drawn,YouTube
naughtomaton,Give us a flying Brian,showbot
naughtomaton,Totally gassed on the treads,showbot
trpw,Browned Off,showbot
trpw,Hat History Time,showbot
trpw,Limited Junk-Protection Loin Cloths,showbot
trpw,No Other Chucks Need Apply,showbot
trpw,The Morning Stream: Generally Wholesome,showbot
trpw,The Ucker in the Trucker Hat,showbot
trpw,There Were TWO CHUCKS,showbot
trpw,What the Actual Chuck,showbot
