author,title,source,time
Searanex, Occasionally wipe your butt,YouTube,2024-12-18 11:19:23.594344
Badpour, are you prepared for my limp christmaschristmas,YouTube,2024-12-18 11:19:31.305058
JayFunktastic, Important Butthole Speach,YouTube,2024-12-18 11:22:09.539525
Matthew Sargent, Goop and Gore and Blood,YouTube,2024-12-18 11:22:23.092984
Searanex, Hardcore carded,YouTube,2024-12-18 11:24:27.970978
Searanex," Checking for the senior discount, not drinking age",YouTube,2024-12-18 11:25:32.293366
Dr.Calhoun, Flacid bacon,YouTube,2024-12-18 11:27:49.217781
1980sWiki, Flaccid Bacon,YouTube,2024-12-18 11:27:56.987998
TheWraith86," Are You Ready For My Limp, Limp, Bacon?",YouTube,2024-12-18 11:28:27.300273
ZoeBringsBacon, Prechewed Bacon,YouTube,2024-12-18 11:28:35.094415
Squishy (Squishy), Pre-chewed TMS,YouTube,2024-12-18 11:28:42.725006
ZoeBringsBacon, Going Full George's Parents,YouTube,2024-12-18 11:28:56.058529
Searanex, Prechewed senior meal,YouTube,2024-12-18 11:29:03.838390
Ian L (i_am_scifi), I Don't Like AARPeeeeeeeeee,YouTube,2024-12-18 11:29:05.963524
Redlynx, Floppy or stiff bacon?,YouTube,2024-12-18 11:29:19.664469
Searanex, Temuish,YouTube,2024-12-18 11:31:42.379936
Redlynx, There's a little Temu going on,YouTube,2024-12-18 11:32:29.294774
Ian L (i_am_scifi), That Guy on Temu Lied,YouTube,2024-12-18 11:33:33.156393
Monica Stone, Blame Dunaway,YouTube,2024-12-18 11:34:37.297627
Searanex, Interpreting the Ali Baba language,YouTube,2024-12-18 11:35:41.234888
Clare Gak, Get my wishes out of you effing mouth!,YouTube,2024-12-18 11:42:44.808257
JayFunktastic, Great at picking up the teens,YouTube,2024-12-18 11:50:50.477010
Red Fraggle, picking up the teens,YouTube,2024-12-18 11:50:52.832722
Scott Johnson, A Jug of The Ocean,YouTube,2024-12-18 11:51:34.297159
WindMagus, No one fights like Gaston,YouTube,2024-12-18 11:52:27.249303
Red Fraggle, (s) nine points for Gaston,YouTube,2024-12-18 11:52:57.802088
Brian Dunaway, Shrek...mmmm,YouTube,2024-12-18 11:53:28.100710
Biocow, I would be more than pleased to back you up in a fight.,YouTube,2024-12-18 11:55:44.943842
Red Fraggle, Amberdick,YouTube,2024-12-18 11:56:04.085987
ZoeBringsBacon, Worms On The Amberdick,YouTube,2024-12-18 11:56:06.372620
Tonda Gossa, amber dick is the color of my energy,YouTube,2024-12-18 11:56:08.678551
WindMagus, Amberdick is the color of your energy,YouTube,2024-12-18 11:56:16.546311
Searanex, Floppy demo worms with Dunaway,YouTube,2024-12-18 11:57:03.908125
Josh3point0_CTG, Make those fart jokes Billie,YouTube,2024-12-18 12:03:05.557825
ZoeBringsBacon, Toilet Paper Routers,YouTube,2024-12-18 12:06:52.748709
ZoeBringsBacon, TP Routers With Tom,YouTube,2024-12-18 12:07:34.493104
BrainbowBrite99, Talking TP and Backdoors with Tom,YouTube,2024-12-18 12:08:10.619030
dross1705, Scott's Backdoor,YouTube,2024-12-18 12:08:18.473899
TheWraith86," Tik Toxic, with Tom",YouTube,2024-12-18 12:10:40.970934
Matthew Sargent, Not Liking Facebook with Tom,YouTube,2024-12-18 12:11:10.969898
Monica Stone, (s) TikTok Til It Stops Stops... With Tom,YouTube,2024-12-18 12:12:08.798396
dross1705, Jackin the Box with Niccole,YouTube,2024-12-18 12:15:09.712611
Matthew Sargent, The Proto Goop of Yacht Rock,YouTube,2024-12-18 12:20:43.333490
TheWraith86, Yacht Rock Adjacent,YouTube,2024-12-18 12:21:52.862858
Ian L (i_am_scifi), Yacht Rock or Naught with Randy and Nicole,YouTube,2024-12-18 12:22:45.291357
JoeGuyArt, The Red One,YouTube,2024-12-18 12:34:49.962120
Ian L (i_am_scifi), Everything's Made Up and the Ratings Don't Matter with Randy and Nicole,YouTube,2024-12-18 12:37:18.498838
Matthew Sargent, Boobies 'n' Things,YouTube,2024-12-18 12:56:57.224313
