author,title,source
Aahz,Cinco de la muertos,YouTube
Aahz,George Washington's Sweetlips,YouTube
Aahz,Super Absorbent Boy!,YouTube
Aahz,hair in a bun with Bobby,YouTube
Bobby Frankenberger,Bounty Butt,YouTube
C Mavros,Scott admits he's a limp 💩,YouTube
Clare Gak,Bobby the Size Rat Man,YouTube
Clare Gak,Flaccid Dorito,YouTube
Clare Gak,Soggy Boy Butt,YouTube
Clare Gak,The Great Vatican Pope Off,YouTube
Clare Gak,The Pope's Erection,YouTube
Clare Gak,"You're Wet, John Snow",YouTube
Dr.Calhoun,Proud of this Candle Guy,YouTube
FreeRangers,A little tip right in Gerogia;s taint,YouTube
Graeme Ellis (KAPT Kipper),10cc Bizkit,YouTube
Graeme Ellis (KAPT Kipper),It's Hank Hill's dog!,YouTube
Graeme Ellis (KAPT Kipper),Low Iron Scores,YouTube
Ian L (i_am_scifi),Dee See Dent?,YouTube
Ian L (i_am_scifi),Gotta Move Fast,YouTube
Ian L (i_am_scifi),Is it Science with Bobby or Just AI?,YouTube
Ian L (i_am_scifi),Lottery Xtreeeeeeme,YouTube
Ian L (i_am_scifi),Nightmare Frizz with Bobby,YouTube
Ikcor,Andre the Oil Checker,YouTube
Ikcor,Bounty Bleacher Butt Boy,YouTube
Ikcor,Business Hair with Bobby,YouTube
Ikcor,Cinco del los Muertos,YouTube
Ikcor,The Fart of Something New,YouTube
Ikcor,The Medium Kahuna,YouTube
JayFunktastic,2 Fast 2 Short with Bobby,YouTube
JayFunktastic,F to the top!,YouTube
JayFunktastic,High School Musical the Junior High School Musical,YouTube
JayFunktastic,Mexican Skeletons,YouTube
JayFunktastic,Oozing Science with Bobby,YouTube
JayFunktastic,Ringing a Dingy,YouTube
JayFunktastic,School plays are gross and weird,YouTube
JayFunktastic,the butt soaker,YouTube
LeonimuZ,Bleacher Water,YouTube
LeonimuZ,Fast and Short GPT,YouTube
LeonimuZ,Gym Stinks! The Musical!,YouTube
LeonimuZ,Load up your decks,YouTube
LeonimuZ,Pope Smoke,YouTube
LeonimuZ,Shamwow kid,YouTube
LeonimuZ,Summarize your papers,YouTube
LeonimuZ,Teenager Retriever.,YouTube
LeonimuZ,The Pope Supremacy,YouTube
LeonimuZ,White smoke for the Pope,YouTube
LeonimuZ,limp bizkit is not about the liquids,YouTube
Matooba,tough chips mr Johnson,YouTube
Matthew Sargent,AITLDR,YouTube
Matthew Sargent,Bathing in Knowledge with Bobby,YouTube
Matthew Sargent,Humans and their proclivity towards whites,YouTube
Matthew Sargent,Scooping Up Bobby's Ooze,YouTube
Monica Stone,Hades Coffin Rides,YouTube
Red Fraggle,Bodily Fluid Lottery,YouTube
Red Fraggle,"Meet the new research, same as the old research with Bobby",YouTube
Red Fraggle,Pope-pourri,YouTube
Red Fraggle,The Butt Soaker,YouTube
Red Fraggle,Things on the ground,YouTube
Red Fraggle,Turkey Straw,YouTube
Red Fraggle,What the fluids do to the biscuit,YouTube
Red Fraggle,Who wants the neck?,YouTube
Redlynx,Two times lucky!,YouTube
Searanex,Cutting open a bag with Accam's Razor,YouTube
TheWraith86,Scott peed on the bench?,YouTube
Thomas Chambers,Deep In The Taint Of Georgia,YouTube
Tim Watson (TRPW),Everyone Thought I Peeeeeeeeeeed,YouTube
Tim Watson (TRPW),"Giant by Name, Andre by Nature",YouTube
Tim Watson (TRPW),Keep that Heme tight,YouTube
Tim Watson (TRPW),King Tut or kinked up,YouTube
Tim Watson (TRPW),Linky Wingy Thing,YouTube
Tim Watson (TRPW),"Looking Cool, Feeling Bad",YouTube
Tim Watson (TRPW),Pet or First Lady,YouTube
Tim Watson (TRPW),Pirate High School Musical,YouTube
Tim Watson (TRPW),Shift and Catch Wind,YouTube
Tim Watson (TRPW),Singing into the Can for over ten years,YouTube
Tim Watson (TRPW),Smell the Moistness,YouTube
Tim Watson (TRPW),Sucking on that Turkey Neck,YouTube
Tim Watson (TRPW),Super-absorbent Teenager,YouTube
Tim Watson (TRPW),Uck Uck Uck. Uck to the Top,YouTube
Tom Norman,Anchorite? AnchorWRONG!,YouTube
WindMagus,"(s) An Iron or not, I’m looking at rocks (believe it or not, I’m walking on air)",YouTube
WindMagus,"(s) The quilted quicker picker upper, boy butt",YouTube
WindMagus,"(s) oh Manatoba, Manatoba, Manatoba figaro. (Queen’s Bohemian Rhapsody)",YouTube
WindMagus,AI TL:DR with Bobby,YouTube
WindMagus,Bleach your Pumpkin,YouTube
WindMagus,Defcon fart,YouTube
WindMagus,Fingering the competition,YouTube
WindMagus,Florida: Just the Tip,YouTube
WindMagus,Hades Funeral Service: we provide the two coins,YouTube
WindMagus,Happy Birthday to Randyyyyyy,YouTube
WindMagus,I don’t like Dwarves,YouTube
WindMagus,Join AARP and get a trunk divider,YouTube
WindMagus,Never go full Bleach,YouTube
WindMagus,Pope Wannabes,YouTube
WindMagus,Pope erection,YouTube
WindMagus,Serious Hair with Bobby,YouTube
WindMagus,Sing not Tell with Bobby,YouTube
WindMagus,Thanks or Treat,YouTube
WindMagus,What Pope-tentually could happen,YouTube
ZoeBringsBacon,Hair-Up Bobby Means Trouble,YouTube
ZoeBringsBacon,The Illegal Junior High Play,YouTube
awhatnot,"Are you ready to receive my limp, limp chip?",YouTube
awhatnot,Pop Erection,YouTube
awhatnot,Soggy Bottom Boy,YouTube
chuck (amy's person),"Liquid assult, the musical",YouTube
chuck (amy's person),Poperection,YouTube
macaddict89,smelled the moistness,YouTube
moose2271,Doesn&#039;t have a hairy leg to stand on,showbot
trpw,"Remember Remember the fifth of November, Gunpowder Treason and Plot",showbot
