author,title,source,time
Searanex,Death metal Christmas carols,showbot,Scraped
Searanex,Forkin' the bacon,showbot,Scraped
Searanex,Full of wind,showbot,Scraped
Wickedkitten13,"Apologise to the Animals, Not the Vegans!",showbot,Scraped
ambassador_domo,Airy Whistler,showbot,Scraped
trpw,Thicc Bacon,showbot,Scraped
trpw,Thickened Bacon,showbot,Scraped
Searanex, Full of wind,YouTube,2024-12-20 11:13:01.240248
Tim Watson (TRPW), (v) Well Aren't Fridays Special,YouTube,2024-12-20 11:13:03.705423
Red Fraggle," That’ll do, Bacon",YouTube,2024-12-20 11:13:05.790909
Monica Stone," Apologise to the Animals, Not the Vegans!",YouTube,2024-12-20 11:13:07.784661
Red Fraggle, (s) Simply Having a Death Metal Christmastime,YouTube,2024-12-20 11:13:10.331679
macaddict89, take the ride for free,YouTube,2024-12-20 11:14:20.109262
Tim Watson (TRPW), Ho' Malone,YouTube,2024-12-20 11:15:01.883147
Searanex, OF COURSE they played Mariah Carey,YouTube,2024-12-20 11:15:48.976325
Red Fraggle, Light Angel O Face,YouTube,2024-12-20 11:15:56.947018
Amy Waggoner, Snowmen O-face,YouTube,2024-12-20 11:16:04.779035
Red Fraggle, Snowman O Face,YouTube,2024-12-20 11:16:12.787262
macaddict89, how when you do the 3d printer?,YouTube,2024-12-20 11:16:48.803339
Sunbun, How wen yuou do the 3d printer?,YouTube,2024-12-20 11:17:07.655315
Red Fraggle, (s) Print stuff every day,YouTube,2024-12-20 11:19:12.999040
ZoeBringsBacon, Smoke Weed And Print Every Day,YouTube,2024-12-20 11:19:20.799749
Tim Watson (TRPW), How very When of you,YouTube,2024-12-20 11:19:22.980426
Searanex, (s) Print stuff ev'ryday,YouTube,2024-12-20 11:19:42.092164
Scott Johnson, Gay Lions,YouTube,2024-12-20 11:20:01.156043
Tim Watson (TRPW)," The Lion King, The Witch and the Wardrobe",YouTube,2024-12-20 11:20:48.348067
Monica Stone,b,YouTube,2024-12-20 11:20:50.496324
Monica Stone,howbot,YouTube,2024-12-20 11:21:15.053858
Tim Watson (TRPW), Underpowered Manuel Miranda,YouTube,2024-12-20 11:21:50.878794
Tim Watson (TRPW), Cheech and Whoopee,YouTube,2024-12-20 11:26:39.514304
Clare Gak," you'll have no cheech, no whoopie and NO LT YAR",YouTube,2024-12-20 11:26:47.425030
Red Fraggle, Cheech and Whoopi with a side of Rogen,YouTube,2024-12-20 11:27:00.846872
Searanex," You'll get NO Cheech, NO Whoopi, and NO Ltn. Yarr!",YouTube,2024-12-20 11:27:08.596685
Tim Watson (TRPW), All Danica McKellar. All The Time,YouTube,2024-12-20 11:28:06.712202
Tim Watson (TRPW), (s) Have Your Self A Mar-a-Lago Christmas,YouTube,2024-12-20 11:29:22.386820
Searanex, Congrats! That's incorrect!,YouTube,2024-12-20 11:29:58.546735
BrainbowBrite99, A Breakfast thing you force kids to do,YouTube,2024-12-20 11:30:35.265699
Searanex, You don't drink Malt-o-meal,YouTube,2024-12-20 11:30:59.973204
Tim Watson (TRPW), I Pulled Candy Corn Out of My Ass,YouTube,2024-12-20 11:32:31.734717
Searanex, Just dumping syrup,YouTube,2024-12-20 11:32:50.739107
Clare Gak, Santa Clause Does Martians,YouTube,2024-12-20 11:34:00.109453
Tim Watson (TRPW), Everyone Knows that there is No Sanity Clause,YouTube,2024-12-20 11:34:02.130650
Searanex, Santa Claus does martians,YouTube,2024-12-20 11:34:09.668437
FriendlySleet, Peanuts are not for christmas,YouTube,2024-12-20 11:35:30.616638
Red Fraggle, (v) Every time a bell rings,YouTube,2024-12-20 11:37:47.597413
Tim Watson (TRPW), (s) It's a Copyright Wonderful Life (Black - Wonderful Life),YouTube,2024-12-20 11:38:23.482056
Searanex, Reindeer are powered by shitter fumes,YouTube,2024-12-20 11:40:24.276369
Tim Watson (TRPW), Randy Quaid Rabbit Hole,YouTube,2024-12-20 11:41:11.293361
Tim Watson (TRPW), (s) Uptown top-Rankin Bass,YouTube,2024-12-20 11:41:47.109855
Clare Gak, Murder on the Polar Express,YouTube,2024-12-20 11:42:45.798674
Searanex, The Polar Express failed successfully,YouTube,2024-12-20 11:43:55.441625
Searanex, Turns out faces are important,YouTube,2024-12-20 11:44:14.350439
Tim Watson (TRPW)," Polar Express, Polar ExpressAre you real? Yes or no? (Starlight Express - Lloyd-Webber)",YouTube,2024-12-20 11:44:33.369955
Red Fraggle, Oval Teen,YouTube,2024-12-20 11:45:54.680989
klchu, Oval Teens,YouTube,2024-12-20 11:45:57.007506
Searanex, Tongues and poles,YouTube,2024-12-20 11:48:14.315457
Patrick Crummey, The Pornigal Son,YouTube,2024-12-20 11:48:22.198388
Searanex, Oh yeah that guy did porn,YouTube,2024-12-20 11:49:09.632367
Tim Watson (TRPW), (s) He's so fine - shoe lamp-shoe lamp-shoe lamp (The Chiffons),YouTube,2024-12-20 11:49:11.552266
macaddict89, Jamming Ron Jeremy in,YouTube,2024-12-20 11:49:25.080282
Amy Waggoner, I wanna go back and find Ron Jeremy,YouTube,2024-12-20 11:49:32.895127
klchu, Inserteing Ron Jeremy,YouTube,2024-12-20 11:49:51.802112
naughtomaton, Throwing a person makes an impression.,YouTube,2024-12-20 11:50:39.196686
