author,title,source,time
Red Fraggle, Stair Condom,YouTube,2025-01-02 11:00:36.903516
WarpForged, Permanent Condom,YouTube,2025-01-02 11:00:44.935213
WarpForged, A mouse or a man?,YouTube,2025-01-02 11:02:22.950055
Matthew Sargent, Juice of the Morning,YouTube,2025-01-02 11:15:49.874271
JayFunktastic, Just call me fig newton Juice of the Morning,YouTube,2025-01-02 11:16:31.531402
Shaun Bloom, Sippin' that Gin and Juice of the Morning!,YouTube,2025-01-02 11:16:39.898728
Redlynx, Fig Newton of the morning,YouTube,2025-01-02 11:16:42.109800
Monica Stone," (s) Just Drink Your Juice of the Morning, Bri-an",YouTube,2025-01-02 11:16:44.569347
WindMagus, Traffic for the Avalanche,YouTube,2025-01-02 11:18:44.968191
Matthew Sargent, Dark Workout Concoctions,YouTube,2025-01-02 11:20:50.783315
Max Trollbot, CostProseco,YouTube,2025-01-02 11:22:11.857396
Ian L (i_am_scifi), Does Costco Make Prosecco Because I Like Really Wanted to Know,YouTube,2025-01-02 11:22:19.796848
Ian L (i_am_scifi), Love Dem Hotdog Chains,YouTube,2025-01-02 11:22:50.013817
JayFunktastic, The Ibbotts: old as hot dogs,YouTube,2025-01-02 11:23:03.308404
ZoeBringsBacon, Moist Hoist,YouTube,2025-01-02 11:23:22.552893
Dr.Calhoun, Moist Fitness,YouTube,2025-01-02 11:23:30.678575
BrainbowBrite99, Don't Be Moist with your Fitness,YouTube,2025-01-02 11:23:38.819983
ZoeBringsBacon, Don't Be Moist,YouTube,2025-01-02 11:23:46.618559
Disturbed Angel, Run around the thing doing the thing.,YouTube,2025-01-02 11:25:24.386878
Matthew Sargent, Like a Thousand Dead Fish,YouTube,2025-01-02 11:25:37.975342
Searanex, Running away from a whale carcass,YouTube,2025-01-02 11:26:30.676254
ZoeBringsBacon, Dead Fish At The Gym,YouTube,2025-01-02 11:26:44.247546
Louis, zombie run with dead fish,YouTube,2025-01-02 11:27:19.838030
ZoeBringsBacon, The No Food Restaurant,YouTube,2025-01-02 11:29:19.814151
Searanex," We'll order the dinner, hold the dinner",YouTube,2025-01-02 11:29:21.822988
Searanex," Oh by the way, Monk",YouTube,2025-01-02 11:30:53.891672
Matthew Sargent, Monk 'Til Midnight,YouTube,2025-01-02 11:31:01.557767
Searanex," Holy crap, Willem Defoe!",YouTube,2025-01-02 11:33:07.190052
WindMagus," That was good, let’s go see the kids.",YouTube,2025-01-02 11:33:31.822595
Ian L (i_am_scifi), Willem and the Weird,YouTube,2025-01-02 11:34:35.887959
Ian L (i_am_scifi)," I'm a Bit of a Weirdo Myself, Y'know",YouTube,2025-01-02 11:35:00.700621
Ikcor, Wickless Wonder,YouTube,2025-01-02 11:36:10.448467
JayFunktastic, Anti Wick,YouTube,2025-01-02 11:36:29.684065
Searanex, I don't want to eat my car!,YouTube,2025-01-02 11:41:40.700873
ZoeBringsBacon, All The Dads Shut Up,YouTube,2025-01-02 11:41:48.732929
JayFunktastic, All You Dads Shut Up!!,YouTube,2025-01-02 11:42:07.623105
BrainbowBrite99, Watch for Falling Nuts,YouTube,2025-01-02 11:43:11.370739
Matthew Sargent, Zoomy Fingers Johnson,YouTube,2025-01-02 11:43:30.403226
Raven_ctg, holding an old condom,YouTube,2025-01-02 11:44:17.499998
Squishy (Squishy), Playing Chess in Jeans,YouTube,2025-01-02 11:46:34.068914
Ian L (i_am_scifi), The Jordache Maneuver,YouTube,2025-01-02 11:46:58.752006
ZoeBringsBacon, Take Take Take,YouTube,2025-01-02 11:48:58.516640
Squishy (Squishy), Take Take was Taken,YouTube,2025-01-02 11:49:23.001492
bgmncwj, Brian hates comfort,YouTube,2025-01-02 11:49:25.227280
Clare Gak," (s) take take take.. take take take.. take that booty, take that bOOOtay",YouTube,2025-01-02 11:49:27.316134
Michael Ali, MTJeans,YouTube,2025-01-02 11:49:35.046249
Sunbun, The Sanctity of Airline Travel,YouTube,2025-01-02 11:50:39.159066
Searanex, Walmart chess championship,YouTube,2025-01-02 11:51:03.708024
Clare Gak, 2025 is the year of the boomer ;),YouTube,2025-01-02 11:51:28.351136
Clare Gak, everybody has a right to wear sweatpants,YouTube,2025-01-02 11:51:53.082016
Ikcor, Must wear tuxedo to play chess on a plane,YouTube,2025-01-02 11:52:06.528089
Searanex," I hate your pants, but I support your right to wear them",YouTube,2025-01-02 11:52:14.311761
Clare Gak, Vegas '25 NUUDE edition,YouTube,2025-01-02 11:53:52.186750
WarpForged, Frogpants on a Plane!,YouTube,2025-01-02 11:54:33.863039
Ikcor, Adorable VR,YouTube,2025-01-02 11:54:41.496232
Ian L (i_am_scifi), Mouse Goggles,YouTube,2025-01-02 11:54:43.440039
Searanex," VR mice. Not that kind, the other kind",YouTube,2025-01-02 11:54:56.904370
Gerry Tolbert, Simulated Stimuli,YouTube,2025-01-02 11:55:05.006713
Michael Ali, Stimulate your rodents,YouTube,2025-01-02 11:55:35.114366
Louis, A Clockwork Rodent,YouTube,2025-01-02 11:57:40.940335
Searanex, Goggle mounted mouse,YouTube,2025-01-02 11:57:43.449757
Gerry Tolbert, Chicken Matrix,YouTube,2025-01-02 11:58:07.931792
whistl, The Machix,YouTube,2025-01-02 11:58:15.486036
dross1705, Don't stress your meat,YouTube,2025-01-02 11:58:23.249870
whistl, The Machicks,YouTube,2025-01-02 11:58:31.350697
Ian L (i_am_scifi), The Machix Reloaded,YouTube,2025-01-02 11:58:33.551560
Dr.Calhoun, Chickens are too Stupid to Get it,YouTube,2025-01-02 11:58:41.472111
Talia James, I have a license to carry a concealed monkey,YouTube,2025-01-02 11:59:11.530658
Paul Macias, CHiPs and Chimps,YouTube,2025-01-02 11:59:19.524193
Max Trollbot, CHimP,YouTube,2025-01-02 11:59:21.788011
Gerry Tolbert, you can’t drive with a monkey,YouTube,2025-01-02 11:59:52.196574
Ian L (i_am_scifi), I Don't Like Passenger Spider-Monkeeeeeeeys,YouTube,2025-01-02 12:00:00.072708
Searanex," The weed is legal, but the monkey is not",YouTube,2025-01-02 12:00:13.371976
dross1705," You get NO spider monkeys, NO stressed meat, and NO LT YAR",YouTube,2025-01-02 12:00:38.283267
TheWraith86," Dont Monkey, Weed, and Drive",YouTube,2025-01-02 12:00:46.303365
Talia James, HuffPoPo,YouTube,2025-01-02 12:01:16.648330
WarpForged, Money Business,YouTube,2025-01-02 12:02:26.522181
Gerry Tolbert, Monkey Permit and Weed Card Required,YouTube,2025-01-02 12:02:34.106501
JayFunktastic, Monkey Permit,YouTube,2025-01-02 12:02:53.203991
Ikcor, You need monkey permits to do monkey business,YouTube,2025-01-02 12:02:55.557305
Matthew Sargent, Department of Monkey Departments,YouTube,2025-01-02 12:03:14.579518
TVs Travis, Does your Monkey has the proper papers?,YouTube,2025-01-02 12:03:16.554662
Searanex," Excuse me sir, do you have a permit for that monkey?",YouTube,2025-01-02 12:03:24.484615
Ian L (i_am_scifi), Everything's Endangered in Missouri,YouTube,2025-01-02 12:04:05.850155
Louis, DSA - Department for Simian Affairs; no monkey business,YouTube,2025-01-02 12:06:34.105071
Red Fraggle, Bug Happening with Wendi,YouTube,2025-01-02 12:08:34.516542
Searanex," Starting the new year with miscommunication, with Wendi",YouTube,2025-01-02 12:09:49.968423
Sunbun," Giving Birth is Easier Than Running a Therapy Business, with Wendi",YouTube,2025-01-02 12:11:16.952056
Sunbun," Jumping Off a Bridge is More Fun Than Web Design, with Wendi",YouTube,2025-01-02 12:11:47.845964
Tim Watson (TRPW), Lucky to know a Logan,YouTube,2025-01-02 12:14:46.108454
Monica Stone, Doxxing Logan,YouTube,2025-01-02 12:14:54.112042
Monica Stone, Logan's Dox,YouTube,2025-01-02 12:15:07.802226
Matthew Sargent, Therapy Thursday with WAJ,YouTube,2025-01-02 12:15:21.688195
Gerry Tolbert, What E-mail with Wendi,YouTube,2025-01-02 12:15:29.409377
Searanex, New Year's: How does it work? With Wendi,YouTube,2025-01-02 12:16:11.380612
Tim Watson (TRPW), Lucky to know a Logan with Wendi,YouTube,2025-01-02 12:16:13.568745
Tim Watson (TRPW), (s) Goals (goals) Always Believe In Your Soul (Spandau Ballet),YouTube,2025-01-02 12:19:29.747825
Tim Watson (TRPW)," (s) Zine, Zine, Zine. Zine of Scott's (chain of Fools)",YouTube,2025-01-02 12:25:08.900631
Tim Watson (TRPW), Being the non gross you with Wendi,YouTube,2025-01-02 12:25:56.410663
Ikcor, Bribing Yourself with Wendi,YouTube,2025-01-02 12:26:15.767949
Tim Watson (TRPW)," (s) Drawing round the hand, that's my kind of Therapy (Taylor Dayne - Tell it to my heart)",YouTube,2025-01-02 12:27:38.083932
Tim Watson (TRPW), Feeling Like This On A Thursday,YouTube,2025-01-02 12:30:25.313845
Ian L (i_am_scifi), Predictions Are Better Than Resolutions with Wendi,YouTube,2025-01-02 12:33:57.707418
Tim Watson (TRPW), Every Year is a rebuilding Year for the Jazz,YouTube,2025-01-02 12:35:25.792185
Sunbun," It's a Rebuilding Year, with Wendi",YouTube,2025-01-02 12:36:19.385356
Gerry Tolbert, Don’t Overgoal Yourself,YouTube,2025-01-02 12:36:38.690554
Josh3point0_CTG, Abe with the face,YouTube,2025-01-02 12:38:22.615980
Clare Gak, respect the player not the pants,YouTube,2025-01-02 12:50:44.310697
